{
  "schemaVersion": "1.0.0",
  "id": "EP-025-practice",
  "revision": 1,
  "kind": "document",
  "name": "EP-025 가상 실습 자료",
  "entrypoint": "guide.md",
  "license": {
    "id": "LicenseRef-Studio-Examples-v1",
    "path": "LICENSE.md"
  },
  "dependencies": {},
  "requiredConnections": [],
  "files": [
    {
      "path": "sample-input.json",
      "bytes": 672,
      "sha256": "3a8122ea59f64d416fc452c84af9ff3d071547db45aef24d9055b1b2a7ce5240"
    },
    {
      "path": "LICENSE.md",
      "bytes": 778,
      "sha256": "1c121659712d0e2712ad0507e17f041c5ebfc31f43a6425de1c640326bc25d02"
    },
    {
      "path": "guide.md",
      "bytes": 889,
      "sha256": "e4ba2c1cbfffc116864f8544e28045cab993ae48cd613779fd3fde4f59e794b1"
    }
  ]
}
