{
  "schemaVersion": "1.0.0",
  "id": "ER-019",
  "revision": 1,
  "kind": "instruction",
  "name": "긴 문맥 요약",
  "entrypoint": "instructions.md",
  "license": {
    "id": "LicenseRef-Studio-Examples-v1",
    "path": "LICENSE.md"
  },
  "dependencies": {},
  "requiredConnections": [],
  "files": [
    {
      "path": "instructions.md",
      "bytes": 2254,
      "sha256": "8d3b950d7304063eab04656a2eaa0c43d3b9e8d131a5d72984605d3ab548712a"
    },
    {
      "path": "README.md",
      "bytes": 1438,
      "sha256": "6ad56be9804b076cc6560adae0a18af2d9fdd81bb80870a092531bb5c7abb4d5"
    },
    {
      "path": "LICENSE.md",
      "bytes": 1296,
      "sha256": "ef6f56f9a001c8535c1951989f81424b4d407d5fc0d3b1dc2f15aba583e3d3a1"
    },
    {
      "path": "templates/result.md",
      "bytes": 748,
      "sha256": "e1ac4d34957f5e07f8702e7cd8297beb242099ef84d864af5a3ec68c0be4aea7"
    },
    {
      "path": "examples/usage.md",
      "bytes": 1186,
      "sha256": "baef00c51dc25ec70fb420b76f805f9c3638e545616bff047e78ac4436645b59"
    }
  ]
}
